School Name,District Name,Reading/Writing Score,Math Score,Tests Taken,# Students SAT ELA Participation
Alcott Humanities High School,City of Chicago SD 299,470.8,461.3,75.0,75.0
North Boone High School,North Boone CUSD 200,477.9,468.5,123.0,123.0
Armstrong High School,Armstrong Twp HSD 225,467.9,440.6,33.0,33.0
Dwight High School,Dwight Twp HSD 230,503.5,508.7,55.0,55.0
Benton Cons High School,Benton Cons HSD 103,475.0,476.7,139.0,139.0
Mahomet-Seymour High School,Mahomet-Seymour CUSD 3,548.1,578.5,211.0,211.0
Warren Township High School,Warren Twp HSD 121,521.6,519.1,975.0,975.0
Perspectives Chtr -  IIT Campus,City of Chicago SD 299,428.0,410.4,106.0,106.0
East Dubuque High School,East Dubuque USD 119,496.0,501.6,50.0,50.0
Elmwood High School,Elmwood CUSD 322,534.6,532.7,48.0,48.0
Hoffman Estates High School,Township HSD 211,505.7,527.5,460.0,460.0
Disney II Magnet HS,City of Chicago SD 299,524.4,481.1,120.0,120.0
East High School,Aurora East USD 131,445.5,439.5,871.0,871.0
Pleasant Hill High School,Pleasant Hill CUSD 3,490.0,454.7,17.0,17.0
Manual High School,Peoria SD 150,390.8,378.5,144.0,144.0
Dunlap High School,Dunlap CUSD 323,552.0,567.0,304.0,304.0
Harlan Community Academy HS,City of Chicago SD 299,400.3,380.0,101.0,101.0
Casey-Westfield Jr/Sr HS,Casey-Westfield CUSD 4C,478.9,478.4,62.0,62.0
Noble St Chtr-Hansberry College Prep - Silver,City of Chicago SD 299,466.8,459.7,115.0,115.0
Tuscola High School,Tuscola CUSD 301,492.6,484.6,69.0,69.0
Tri-Point High School,Tri Point CUSD 6-J,477.7,451.2,26.0,26.0
Lexington High School,Lexington CUSD 7,512.1,500.7,29.0,29.0
Franklin Jr/Sr High School,Franklin CUSD 1,487.6,476.2,21.0,21.0
West Prairie High School,West Prairie CUSD 103,487.6,449.2,37.0,37.0
Comm H S Dist 99 - South High Sch,CHSD 99,515.1,535.9,652.0,652.0
Fairfield Comm High School,Fairfield Comm H S Dist 225,471.6,437.9,92.0,92.0
Dee-Mack High School,Deer Creek-Mackinaw CUSD 701,526.7,521.2,73.0,73.0
Anna-Jonesboro High School,Anna Jonesboro CHSD 81,482.8,473.1,111.0,111.0
Uplift Community High School,City of Chicago SD 299,392.2,369.4,32.0,32.0
Wm Fremd High School,Township HSD 211,568.6,601.5,661.0,661.0
V I T Sr High School,V I T CUSD 2,466.9,444.6,26.0,26.0
Lockport Township High Sch East,Lockport Twp HSD 205,514.5,519.4,940.0,940.0
Staunton High School,Staunton CUSD 6,479.3,489.7,86.0,86.0
Taylorville Sr High School,Taylorville CUSD 3,475.0,475.4,192.0,192.0
Polo Comm High School,Polo CUSD 222,505.0,497.1,38.0,38.0
Illini West High School,Illini West H S Dist 307,475.4,445.7,74.0,74.0
Glenwood High School,Ball Chatham CUSD 5,531.2,534.8,312.0,312.0
Carlyle High School,Carlyle CUSD 1,485.7,479.7,65.0,65.0
West Leyden High School,Leyden CHSD 212,471.8,462.1,397.0,397.0
Hinsdale South High School,Hinsdale Twp HSD 86,522.0,530.0,326.0,326.0
Astoria High School,Astoria CUSD 1,464.4,414.4,27.0,27.0
Joliet Central High School,Joliet Twp HSD 204,446.4,439.5,773.0,773.0
Bartlett High School,SD U-46,496.0,494.8,535.0,535.0
Sangamon Valley High School,Sangamon Valley CUSD 9,492.8,489.7,64.0,64.0
Iroquois West High School,Iroquois West CUSD 10,470.0,461.4,84.0,84.0
Beecher City Jr-Sr High School,Beecher City CUSD 20,471.1,498.9,19.0,19.0
Kansas High School,Kansas CUSD 3,469.2,438.3,12.0,12.0
Centennial High School,Champaign CUSD 4,490.5,492.4,339.0,339.0
Pleasant Plains High School,Pleasant Plains CUSD 8,539.8,530.3,90.0,90.0
Milford High School Campus,Milford Area Public Schools District 124,506.5,485.9,49.0,49.0
Plainfield East High School,Plainfield SD 202,514.6,526.3,551.0,551.0
Grant Park High School,Grant Park CUSD 6,469.8,455.1,47.0,47.0
Brooks College Prep Academy HS,City of Chicago SD 299,565.8,559.6,209.0,209.0
Riverdale Sr High School,Riverdale CUSD 100,494.3,495.3,83.0,83.0
El Paso-Gridley High School,El Paso-Gridley CUSD 11,530.3,488.4,92.0,92.0
Raby High School,City of Chicago SD 299,391.1,385.3,62.0,62.0
Ridgeview High School,Ridgeview CUSD 19,494.3,494.0,35.0,35.0
Meridian High School,Meridian CUSD 15,474.5,467.2,53.0,53.0
R O W V A Jr and  Sr High School,R O W V A CUSD 208,477.3,443.8,37.0,37.0
Lincoln-Way Central High School,Lincoln Way CHSD 210,548.5,555.5,480.0,480.0
Richmond-Burton High School,Richmond-Burton CHSD 157,526.6,533.6,168.0,168.0
John Hersey High School,Township HSD 214,572.5,584.3,486.0,486.0
Massac County High School,Massac UD 1,484.0,473.6,141.0,141.0
Mundelein Cons High School,Mundelein Cons HSD 120,508.3,502.7,502.0,502.0
Lincoln-Way East High School,Lincoln Way CHSD 210,551.7,558.5,692.0,692.0
Auburn High School,Rockford SD 205,481.0,467.7,391.0,391.0
Round Lake Senior High School,Round Lake CUSD 116,449.2,438.9,505.0,505.0
Metamora High School,County of Woodford School,525.4,539.9,236.0,236.0
J Sterling Morton West High Sch,J S Morton HSD 201,458.3,430.1,814.0,814.0
Hillsboro High School,Hillsboro CUSD 3,485.8,453.4,130.0,130.0
Hirsch Metropolitan High School,City of Chicago SD 299,392.8,374.1,46.0,46.0
Senn High School,City of Chicago SD 299,489.3,487.9,336.0,336.0
Stark County High School,Stark County CUSD 100,455.0,447.6,46.0,46.0
Amos Alonzo Stagg High School,Cons HSD 230,507.5,512.5,566.0,566.0
Winchester High School,Winchester CUSD 1,466.3,444.8,40.0,40.0
Evergreen Park High School,Evergreen Park CHSD 231,501.3,503.7,199.0,199.0
Herrin High School,Herrin CUSD 4,477.9,471.9,172.0,172.0
Wheaton North High School,CUSD 200,545.4,548.3,501.0,501.0
School of Social Justice HS,City of Chicago SD 299,425.6,434.1,61.0,61.0
Oakwood High School,Oakwood CUSD 76,474.7,463.5,78.0,78.0
Western High School,Western CUSD 12,493.5,494.7,34.0,34.0
Normal Community West High School,McLean County USD 5,506.7,496.1,371.0,371.0
Collinsville High School,Collinsville CUSD 10,476.2,466.6,442.0,442.0
Madison Senior High School,Madison CUSD 12,396.5,379.8,48.0,48.0
Abingdon-Avon High Sch,Abingdon-Avon CUSD 276,473.4,431.9,67.0,67.0
Rockridge High School,Rockridge CUSD 300,502.1,491.4,92.0,92.0
Galatia High School,Galatia CUSD 1,448.7,430.7,30.0,30.0
Woodlawn High School,Woodlawn Unit School District 209,498.9,489.4,36.0,36.0
Lowpoint-Washburn Jr Sr High Sch,Lowpoint-Washburn CUSD 21,479.4,458.8,33.0,33.0
South Fork Jr Sr High School,South Fork SD 14,454.7,388.9,19.0,19.0
Peotone High School,Peotone CUSD 207U,504.0,476.8,132.0,132.0
Fenger Academy High School,City of Chicago SD 299,392.2,372.1,76.0,76.0
Cambridge Jr/Sr High School,Cambridge CUSD 227,487.7,456.7,30.0,30.0
Neuqua Valley High School,Indian Prairie CUSD 204,592.4,611.9,859.0,859.0
East Alton-Wood River High Sch,East Alton-Wood River CHSD 14,454.7,435.8,125.0,125.0
Wauconda High School,Wauconda CUSD 118,506.1,493.2,316.0,316.0
Southeastern Jr/Sr High School,Southeastern CUSD 337,471.3,457.5,40.0,40.0
Dongola High School,Dongola USD 66,421.6,377.6,25.0,25.0
Seneca High School,Seneca Twp HSD 160,490.8,494.8,99.0,99.0
River Ridge High School,River Ridge CUSD 210,500.6,545.3,34.0,34.0
Hamilton Jr/Sr High Sch,Hamilton CCSD 328,482.1,468.3,42.0,42.0
Jefferson High School,Rockford SD 205,437.9,425.1,333.0,333.0
Corliss High School,City of Chicago SD 299,402.4,394.6,70.0,70.0
Northwestern High School,Northwestern CUSD 2,470.0,461.6,25.0,25.0
Normal Community High School,McLean County USD 5,527.1,534.0,521.0,521.0
Legacy Acad of Excellence Charter Sch,Rockford SD 205,378.0,328.0,,
Young Magnet High School,City of Chicago SD 299,637.4,655.4,462.0,462.0
SIU Charter Sch of East St Louis,East St Louis SD 189,405.9,380.5,37.0,37.0
Paw Paw Jr/Sr High School,Paw Paw CUSD 271,451.4,448.6,,
Schurz High School,City of Chicago SD 299,429.5,423.5,352.0,352.0
Wheeling High School,Township HSD 214,485.0,493.8,432.0,432.0
Evanston Twp High School,Evanston Twp HSD 202,540.1,540.7,793.0,793.0
Mount Vernon High School,Mt Vernon Twp HSD 201,460.6,451.1,263.0,263.0
New Athens High School,New Athens CUSD 60,490.0,456.4,45.0,45.0
Glenbard South High School,Glenbard Twp HSD 87,525.2,529.4,280.0,280.0
Prairie Ridge High School,CHSD 155,543.2,562.9,341.0,341.0
Back of The Yards IB HS,City of Chicago SD 299,475.0,490.7,270.0,270.0
Ridgewood Comm High School,Ridgewood CHSD 234,490.8,473.0,209.0,209.0
Beecher High School,Beecher CUSD 200U,512.4,481.8,88.0,88.0
Central High School,Central CUSD 301,533.1,540.2,289.0,289.0
Air Force Acad High School,City of Chicago SD 299,443.4,434.2,53.0,53.0
Dupo High School,Dupo CUSD 196,467.9,462.3,61.0,61.0
Lewistown Jr/Sr High School,Lewistown CUSD 97,482.1,448.8,56.0,56.0
Streamwood High School,SD U-46,471.9,464.4,464.0,464.0
Heyworth Jr-Sr High School,Heyworth CUSD 4,495.3,480.7,76.0,76.0
Amandla Charter School,Amandla Charter School,389.1,375.9,70.0,70.0
Noble St Chtr-Comer College Prep,City of Chicago SD 299,463.4,452.3,191.0,191.0
Austin College and Career Academy High School,City of Chicago SD 299,384.7,383.1,58.0,58.0
Pontiac High School,Pontiac Twp HSD 90,481.7,483.6,144.0,144.0
Edinburg High School,Edinburg CUSD 4,442.0,431.0,10.0,10.0
Eisenhower High School,Decatur SD 61,418.6,404.8,258.0,258.0
Midland High School,Midland CUSD 7,521.6,499.6,55.0,55.0
Altamont High School,Altamont CUSD 10,472.1,474.9,47.0,47.0
Spry Community Links High School,City of Chicago SD 299,422.2,421.9,32.0,32.0
YCCS-Olive Harvey Mid College HS,City of Chicago SD 299,387.3,369.8,44.0,44.0
Westinghouse High School,City of Chicago SD 299,521.0,527.2,271.0,271.0
Johnsburg High School,Johnsburg CUSD 12,505.2,505.8,149.0,149.0
Steeleville High School,Steeleville CUSD 138,499.4,490.3,35.0,35.0
Hall High School,Hall HSD 502,481.3,486.0,104.0,104.0
Bolingbrook High School,Valley View CUSD 365U,484.8,491.9,853.0,853.0
Illini Central High School,Illini Central CUSD 189,478.6,426.8,37.0,37.0
Mt Zion High School,Mt Zion CUSD 3,520.2,522.1,212.0,212.0
Paris Cooperative High School,Paris Cooperative High School,484.2,472.8,142.0,142.0
Springfield High School,Springfield SD 186,516.8,509.8,275.0,275.0
DePue High School,DePue USD 103,423.3,414.2,24.0,24.0
Woodland High School,Woodland CUSD 5,459.0,478.2,39.0,39.0
Noble St Chtr-DRW Trading College Prep,City of Chicago SD 299,429.5,427.4,77.0,77.0
Mendota Twp High School,Mendota Twp HSD 280,483.7,491.2,125.0,125.0
Elmwood Park High School,Elmwood Park CUSD 401,490.7,490.1,210.0,210.0
Cairo Jr/Sr High School,Cairo USD 1,419.3,400.0,14.0,14.0
Pearl City High School,Pearl City CUSD 200,496.4,490.7,28.0,28.0
Chicago Academy High School,City of Chicago SD 299,468.7,452.4,141.0,141.0
Ottawa Township High School,Ottawa Twp HSD 140,491.0,472.9,271.0,271.0
Douglass Academy High School,City of Chicago SD 299,400.0,372.7,15.0,15.0
Salt Fork High School,Salt Fork Community Unit District  512,473.0,467.0,64.0,64.0
McHenry High School-West Campus,McHenry CHSD 156,497.4,498.5,343.0,343.0
ASPIRA Charter - Early College Prep HS,City of Chicago SD 299,421.6,424.8,85.0,85.0
Dunbar Vocational Career Acad HS,City of Chicago SD 299,402.1,386.3,75.0,75.0
Oakland High School,Oakland CUSD 5,488.1,443.8,16.0,16.0
O Fallon High School,O Fallon Twp HSD 203,533.3,540.3,587.0,587.0
Gage Park High School,City of Chicago SD 299,397.9,381.7,121.0,121.0
Ohio Community High School,Ohio CHSD 505,437.5,436.3,,
Lincoln Comm High School,Lincoln CHSD 404,488.4,484.1,185.0,185.0
Mercer County High School,Mercer County School District 404,507.6,494.4,84.0,84.0
Sterling High School,Sterling CUSD 5,474.8,475.3,230.0,230.0
Chicago Excel Academy HS,City of Chicago SD 299,399.5,375.4,57.0,57.0
Sandoval Sr High School,Sandoval CUSD 501,447.9,403.2,19.0,19.0
Bogan High School,City of Chicago SD 299,406.1,400.3,230.0,230.0
Elk Grove High School,Township HSD 214,500.0,508.2,463.0,463.0
Barrington High School,Barrington CUSD 220,565.0,582.1,764.0,764.0
Somonauk High School,Somonauk CUSD 432,494.5,500.5,75.0,75.0
YCCS-Jane Addams Alternative HS,City of Chicago SD 299,414.5,395.2,42.0,42.0
J B Conant High School,Township HSD 211,535.8,563.0,576.0,576.0
Proviso Math and Science Academy,Proviso Twp HSD 209,574.4,579.3,165.0,165.0
Webber High School,Bluford Unit School District 318,480.7,464.8,29.0,29.0
Proviso East High School,Proviso Twp HSD 209,421.1,404.9,367.0,367.0
Knoxville Sr High School,Knoxville CUSD 202,493.4,478.5,79.0,79.0
Rushville-Industry High School,Schuyler-Industry CUSD 5,479.2,460.7,86.0,86.0
Peoria Heights High School,Peoria Heights CUSD 325,447.3,449.0,48.0,48.0
Lindblom Math & Science Acad HS,City of Chicago SD 299,543.3,545.9,266.0,266.0
Palestine High School,Palestine CUSD 3,501.4,465.2,21.0,21.0
Carrollton High School,Carrollton CUSD 1,504.5,516.3,38.0,38.0
CICS - Longwood Campus,City of Chicago SD 299,401.7,386.2,115.0,115.0
Acero Chtr Sch Network Victoria Soto Campus,City of Chicago SD 299,424.9,426.1,142.0,142.0
Williamsville High School,Williamsville CUSD 15,535.1,535.9,98.0,98.0
Foreman High School,City of Chicago SD 299,393.4,392.6,207.0,207.0
Auburn High School,Auburn CUSD 10,499.3,468.0,105.0,105.0
Chicago HS for the Arts,City of Chicago SD 299,506.9,473.3,143.0,143.0
Rockford East High School,Rockford SD 205,441.1,421.7,431.0,431.0
Univ of Chicago Chtr-Woodlawn,City of Chicago SD 299,422.5,427.8,91.0,91.0
Walter Henri Dyett High School for the Arts,City of Chicago SD 299,431.2,414.9,137.0,137.0
Rich South Campus High School,Rich Twp HSD 227,442.4,428.1,204.0,204.0
Martinsville Jr-Sr High School,Martinsville CUSD 3C,491.0,468.6,21.0,21.0
Harvard High School,Harvard CUSD 50,457.8,445.5,170.0,170.0
Bloom High School,Bloom Twp HSD 206,447.8,434.7,392.0,392.0
Eugene Field School,McLean County USD 5,455.0,380.0,,
Kelvyn Park High School,City of Chicago SD 299,419.1,416.2,69.0,69.0
Milledgeville High School,Chadwick-Milledgeville CUSD 399,494.0,464.8,42.0,42.0
Adlai E Stevenson High School,Adlai E Stevenson HSD 125,599.0,623.4,1006.0,1006.0
Tri-City High School,Tri City CUSD 1,446.6,456.3,35.0,35.0
Sycamore High School,Sycamore CUSD 427,524.2,516.6,320.0,320.0
Northside College Preparatory Hs,City of Chicago SD 299,662.1,663.2,269.0,269.0
Windsor Jr & Sr High School,Windsor CUSD 1,451.6,440.5,19.0,19.0
Harry D Jacobs High School,CUSD 300,519.8,528.2,480.0,480.0
Mount Pulaski High School,Mt Pulaski CUSD 23,480.2,465.6,50.0,50.0
Curie Metropolitan High School,City of Chicago SD 299,443.0,449.7,583.0,583.0
Acero Chtr Sch Newtwork- Sor Juana Ines de la Cruz,City of Chicago SD 299,447.6,444.8,25.0,25.0
Clark Acad Prep Magnet High Schl,City of Chicago SD 299,408.5,391.6,117.0,117.0
Monmouth-Roseville High Sch,Monmouth-Roseville CUSD 238,452.4,461.4,128.0,128.0
Thornridge High School,Thornton Twp HSD 205,413.6,396.6,260.0,260.0
YCCS-Scholastic Achievement HS,City of Chicago SD 299,383.2,358.3,63.0,63.0
Sherrard High School,Sherrard CUSD 200,503.0,491.7,104.0,104.0
Leland High School,Leland CUSD 1,460.4,424.4,25.0,25.0
Glenbrook South High School,Northfield Twp HSD 225,569.4,583.7,772.0,772.0
Roosevelt High School,City of Chicago SD 299,421.9,421.1,220.0,220.0
Highland Park High School,Twp HSD 113,554.7,570.6,508.0,508.0
Cahokia High School,Cahokia CUSD 187,404.4,388.0,135.0,135.0
Rantoul Twp High School,Rantoul Township HSD 193,438.3,422.6,178.0,178.0
Crane Medical Prep HS,City of Chicago SD 299,462.2,457.7,115.0,115.0
Sparta High School,Sparta CUSD 140,480.7,458.2,90.0,90.0
Donovan Sr High School,Donovan CUSD 3,470.3,434.5,33.0,33.0
Triopia Jr-Sr High School,Triopia CUSD 27,476.5,467.8,23.0,23.0
Tinley Park High School,Bremen CHSD 228,495.8,491.7,257.0,257.0
YCCS- McKinley-Lakeside Leadership Academy,City of Chicago SD 299,377.9,361.3,63.0,63.0
Goreville High School,Goreville CUD 1,492.1,472.3,39.0,39.0
Porta High School,Porta CUSD 202,500.5,484.1,86.0,86.0
Brown County High School,Brown County CUSD 1,480.8,478.9,37.0,37.0
Lincoln Way West,Lincoln Way CHSD 210,541.0,550.3,468.0,468.0
Marissa Jr & Sr High School,Marissa CUSD 40,458.0,477.1,41.0,41.0
Buffalo Grove High School,Township HSD 214,530.2,564.5,468.0,468.0
EPIC Academy High School,City of Chicago SD 299,439.5,426.0,109.0,109.0
Athens Sr High School,Athens CUSD 213,484.6,476.4,69.0,69.0
New Tech High - Zion-Benton East,Zion-Benton Twp HSD 126,483.3,459.6,70.0,70.0
YCCS-West Town Academy Alt HS,City of Chicago SD 299,376.0,368.8,57.0,57.0
Limestone Community High School,Limestone CHSD 310,492.3,475.8,201.0,201.0
Grayslake Central High School,Grayslake CHSD 127,548.0,541.2,338.0,338.0
Intrinsic Charter High School,City of Chicago SD 299,475.7,487.2,167.0,167.0
Lena-Winslow High School,Lena Winslow CUSD 202,486.3,476.3,65.0,65.0
Morrison High School,Morrison CUSD 6,488.1,501.7,59.0,59.0
Bureau Valley High School,Bureau Valley CUSD 340,494.7,482.1,91.0,91.0
Catalyst Charter - Maria ES,City of Chicago SD 299,444.7,435.1,110.0,110.0
Morrisonville High School,Morrisonville CUSD 1,484.7,486.0,15.0,15.0
Neoga Jr/Sr High School,Neoga CUSD 3,521.9,500.2,48.0,48.0
MacArthur High School,Decatur SD 61,425.8,417.6,307.0,307.0
Forreston Jr/Sr High Sch,Forrestville Valley CUSD 221,486.8,500.7,57.0,57.0
Shawnee High School,Shawnee CUSD 84,515.0,492.5,16.0,16.0
Dixon High School,Dixon USD 170,494.1,484.6,176.0,176.0
Rock Falls Township High School,Rock Falls Twp HSD 301,477.7,461.8,159.0,159.0
Erie High School,Erie CUSD 1,522.0,523.2,44.0,44.0
Elgin High School,SD U-46,448.9,447.0,578.0,578.0
Brownstown High School,Brownstown CUSD 201,431.5,418.8,26.0,26.0
Nokomis Jr/Sr High Sch,Nokomis CUSD 22,465.0,452.0,44.0,44.0
Fisher Jr/Sr High School,Fisher CUSD 1,487.9,488.1,43.0,43.0
Marine Leadership Academy - Ames,City of Chicago SD 299,439.4,443.5,145.0,145.0
Noble St Chtr-Golder College Prep,City of Chicago SD 299,477.8,505.1,144.0,144.0
Glenbard North High School,Glenbard Twp HSD 87,505.6,511.6,544.0,544.0
Noble St Chtr-The Noble Academy,City of Chicago SD 299,495.7,513.0,92.0,92.0
Danville High School,Danville CCSD 118,440.3,420.9,273.0,273.0
United Twp High School,United Twp HSD 30,456.7,447.0,399.0,399.0
Geneseo High School,Geneseo CUSD 228,512.1,504.4,191.0,191.0
Zeigler-Royalton High School,Zeigler-Royalton CUSD 188,469.3,441.4,42.0,42.0
Pinckneyville Comm High School,Pinckneyville CHSD 101,466.6,479.0,92.0,92.0
Chicago Vocational Career Acad HS,City of Chicago SD 299,392.3,389.4,176.0,176.0
Harper High School,City of Chicago SD 299,381.5,375.4,26.0,26.0
Lincolnwood High School,Panhandle CUSD 2,485.0,469.7,34.0,34.0
YCCS-Progressive Leadership Academy,City of Chicago SD 299,374.3,370.5,61.0,61.0
Kenwood Academy High School,City of Chicago SD 299,512.7,507.3,400.0,400.0
Effingham High School,Effingham CUSD 40,486.5,480.3,166.0,166.0
Lake Forest High School,Lake Forest CHSD 115,604.2,613.5,388.0,388.0
Virginia Jr/ Sr High School,Virginia CUSD 64,454.6,406.2,13.0,13.0
YCCS-Association House,City of Chicago SD 299,408.7,393.3,55.0,55.0
Thomas Kelly College Preparatory,City of Chicago SD 299,422.2,436.2,474.0,474.0
Galesburg High School,Galesburg CUSD 205,475.1,462.9,262.0,262.0
Lebanon High School,Lebanon CUSD 9,472.4,454.1,29.0,29.0
Winnebago High School,Winnebago CUSD 323,495.3,500.8,117.0,117.0
Waubonsie Valley High School,Indian Prairie CUSD 204,544.5,550.4,631.0,631.0
Proviso West High School,Proviso Twp HSD 209,426.2,404.3,426.0,426.0
Dundee-Crown High School,CUSD 300,463.6,472.1,682.0,682.0
Hartsburg-Emden Jr-Sr High School,Hartsburg Emden CUSD 21,487.7,485.9,22.0,22.0
Lake Park High School,Lake Park CHSD 108,528.6,545.1,572.0,572.0
Alden-Hebron High School,Alden Hebron SD 19,546.8,545.6,25.0,25.0
Bowen High School,City of Chicago SD 299,410.2,403.4,62.0,62.0
Community High School,CHSD 94,485.0,483.2,457.0,457.0
Oak Forest High School,Bremen CHSD 228,498.8,490.2,296.0,296.0
Noble St Chtr-Chicago Bulls Prep,City of Chicago SD 299,491.0,527.8,242.0,242.0
YCCS-Albizu Campos Puerto Rican HS,City of Chicago SD 299,396.8,382.3,57.0,57.0
St Elmo Sr High School,St Elmo CUSD 202,500.7,452.5,28.0,28.0
Tilden Career Communty Academy HS,City of Chicago SD 299,391.4,398.8,73.0,73.0
Hutsonville High School,Hutsonville CUSD 1,474.6,454.6,28.0,28.0
Perspectives Chtr - Joslin Campus,City of Chicago SD 299,432.9,415.7,56.0,56.0
Hubbard High School,City of Chicago SD 299,447.2,432.0,401.0,401.0
Von Steuben Metro Science HS,City of Chicago SD 299,519.8,532.5,454.0,454.0
Grayslake North High School,Grayslake CHSD 127,530.8,528.8,351.0,351.0
Thornwood High School,Thornton Twp HSD 205,436.2,425.9,432.0,432.0
Cowden-Herrick Jr/Sr High School,Cowden-Herrick CUSD 3A,438.7,448.7,23.0,23.0
Carlinville High School,Carlinville CUSD 1,504.7,505.4,99.0,99.0
Reed-Custer High School,Reed Custer CUSD 255U,476.8,483.7,116.0,116.0
Riverside Brookfield Twp HS,Riverside-Brookfield Twp SD 208,537.6,545.0,376.0,376.0
Clemente Community Academy HS,City of Chicago SD 299,425.4,396.2,158.0,158.0
Johnston City High School,Johnston City CUSD 1,464.3,454.7,86.0,86.0
West Aurora High School,Aurora West USD 129,461.4,459.1,939.0,939.0
Dakota Jr Sr High School,Dakota CUSD 201,516.5,507.5,68.0,68.0
Urbana High School,Urbana SD 116,476.2,457.6,292.0,292.0
Cary-Grove Community High School,CHSD 155,535.3,542.0,400.0,400.0
Roanoke-Benson High School,Roanoke Benson CUSD 60,527.4,512.9,38.0,38.0
Newark Comm High School,Newark CHSD 18,516.5,481.6,31.0,31.0
Riverton High School,Riverton CUSD 14,483.9,490.7,94.0,94.0
Brussels High School,Brussels CUSD 42,477.9,472.9,14.0,14.0
Peoria High School,Peoria SD 150,403.9,387.4,318.0,318.0
Durand High School,Durand CUSD 322,512.6,496.8,47.0,47.0
Noble St Chtr-ITW Speer Acad,City of Chicago SD 299,503.3,557.6,138.0,138.0
Spoon River Valley Sr High Sch,Spoon River Valley CUSD 4,513.9,474.3,23.0,23.0
Joppa Jr & Sr High School,Joppa-Maple Grove UD 38,451.2,456.5,17.0,17.0
Midwest Central High School,Midwest Central CUSD 191,475.6,467.0,73.0,73.0
Batavia Sr High School,Batavia USD 101,537.7,552.0,466.0,466.0
North Greene Jr/Sr High Sch,North Greene CUSD 3,468.6,429.7,59.0,59.0
Amboy High School,Amboy CUSD 272,504.7,506.3,43.0,43.0
Plainfield South High School,Plainfield SD 202,494.5,501.3,617.0,617.0
Victor J Andrew High School,Cons HSD 230,522.2,516.9,548.0,548.0
Freeport High School,Freeport SD 145,462.1,424.0,267.0,267.0
Noble St Chtr-Butler College Prep - Crimson,City of Chicago SD 299,449.0,460.9,149.0,149.0
Arcola High School,Arcola CUSD 306,478.2,452.7,55.0,55.0
Wesclin Sr High School,Wesclin CUSD 3,516.6,513.1,87.0,87.0
Romeoville High School,Valley View CUSD 365U,496.5,496.6,461.0,461.0
Orangeville High School,Orangeville CUSD 203,472.2,492.2,23.0,23.0
Eastland Jr/Sr High School,Eastland CUSD 308,545.7,529.8,54.0,54.0
Juarez Community Academy HS,City of Chicago SD 299,432.0,415.2,355.0,355.0
North Chicago Community High Sch,North Chicago SD 187,420.4,410.4,135.0,135.0
Hinsdale Central High School,Hinsdale Twp HSD 86,601.6,624.7,659.0,659.0
YCCS-Community Youth Dev Inst HS,City of Chicago SD 299,370.3,345.1,37.0,37.0
Wilmington High School,Wilmington CUSD 209U,481.2,471.8,95.0,95.0
Acero Chtr Sch Network -  Major Hector P Garcia MD Campus,City of Chicago SD 299,449.3,450.3,153.0,153.0
East St Louis Senior High School,East St Louis SD 189,405.0,386.7,294.0,294.0
Carver Military Academy HS,City of Chicago SD 299,459.0,469.2,129.0,129.0
Ramsey High School,Ramsey CUSD 204,462.5,473.1,32.0,32.0
Coal City High School,Coal City CUSD 1,506.6,514.0,163.0,163.0
Richwoods High School,Peoria SD 150,505.3,497.2,277.0,277.0
Noble St Chtr-Pritzker College Prep,City of Chicago SD 299,515.7,548.2,251.0,251.0
Fenton High School,Fenton CHSD 100,481.9,484.8,350.0,350.0
Hillcrest High School,Bremen CHSD 228,423.9,415.9,286.0,286.0
Murphysboro High School,Murphysboro CUSD 186,477.8,457.8,152.0,152.0
Cuba Sr High School,CUSD 3 Fulton County,458.8,402.4,33.0,33.0
South Central High School,South Central CUD 401,448.7,436.1,46.0,46.0
Teutopolis High School,Teutopolis CUSD 50,517.4,542.4,72.0,72.0
Shiloh High School,Shiloh CUSD 1,452.9,419.5,21.0,21.0
South Elgin High School,SD U-46,501.9,502.0,655.0,655.0
Paxton-Buckley-Loda High School,Paxton-Buckley-Loda CUD 10,499.4,500.8,114.0,114.0
Maine West High School,Maine Township HSD 207,495.7,500.5,487.0,487.0
Pope Co High School,Pope Co CUD 1,481.8,451.8,40.0,40.0
North Lawndale Prep Chtr - Christiana,City of Chicago SD 299,411.6,425.4,82.0,82.0
J Sterling Morton East High Sch,J S Morton HSD 201,444.2,420.0,1125.0,1125.0
Marengo High School,Marengo CHSD 154,513.4,515.4,140.0,140.0
Devry Advantage Academy High Schl,City of Chicago SD 299,526.7,549.0,69.0,69.0
Cisne High School,North Wayne CUSD 200,479.7,453.8,32.0,32.0
Tremont High School,Tremont CUSD 702,520.7,520.2,88.0,88.0
Freeburg Community High Sch,Freeburg CHSD 77,528.5,531.8,174.0,174.0
Liberty High School,Liberty CUSD 2,497.6,505.1,49.0,49.0
A B Shepard High Sch (Campus),CHSD 218,487.8,473.6,428.0,428.0
Sullivan High School,Sullivan CUSD 300,474.9,450.6,72.0,72.0
Homewood-Flossmoor High School,Homewood Flossmoor CHSD 233,512.3,503.4,663.0,663.0
North Mac High School,North Mac CUSD 34,485.4,478.6,109.0,109.0
Sandwich Community High School,Sandwich CUSD 430,496.9,498.8,153.0,153.0
Pittsfield High School,Pikeland CUSD 10,500.4,477.2,74.0,74.0
CICS - Ralph Ellison Campus,City of Chicago SD 299,407.1,413.4,76.0,76.0
Okaw Valley High School,Okaw Valley CUSD 302,456.6,436.8,41.0,41.0
Metea Valley High School,Indian Prairie CUSD 204,553.3,573.8,714.0,714.0
Cissna Park Sr High School,Cissna Park CUSD 6,533.7,494.2,19.0,19.0
Payton College Preparatory HS,City of Chicago SD 299,669.7,677.2,282.0,282.0
Red Bud High School,Red Bud CUSD 132,484.2,470.9,106.0,106.0
DD Eisenhower High Sch (Campus),CHSD 218,437.7,436.9,447.0,447.0
Griggsville-Perry High School,Griggsville-Perry CUSD 4,471.2,425.0,26.0,26.0
Belvidere High School,Belvidere CUSD 100,460.0,449.9,270.0,270.0
Woodstock High School,Woodstock CUSD 200,512.1,512.4,233.0,233.0
Bloomington High School,Bloomington SD 87,477.1,460.4,339.0,339.0
Shelbyville High School,Shelbyville CUSD 4,495.4,497.8,69.0,69.0
Fulton High School,River Bend CUSD 2,498.8,458.6,64.0,64.0
Glenbard East High School,Glenbard Twp HSD 87,494.3,489.9,534.0,534.0
Noble St Chtr-Muchin College Prep,City of Chicago SD 299,499.6,519.0,232.0,232.0
Washington G High School,City of Chicago SD 299,452.5,443.5,324.0,324.0
